{
  "schemaVersion": "1.0",
  "releaseId": "tag-only",
  "candidateId": "candidate",
  "sourceRevision": "0123456",
  "createdAt": "2026-07-12T12:00:00Z",
  "images": {"cpu": {"reference": "registry.example/ndnsf-di:latest", "digest": "sha256:aaaaaaaaaaaaaaaaaaaaaaaaaaaaaaaaaaaaaaaaaaaaaaaaaaaaaaaaaaaaaaaa", "platform": "linux/amd64", "backend": "cpu"}},
  "buildInputs": [],
  "sbom": {"location": "sbom.json", "digest": "sha256:cccccccccccccccccccccccccccccccccccccccccccccccccccccccccccccccc"},
  "provenance": {"builder": "test", "digest": "sha256:dddddddddddddddddddddddddddddddddddddddddddddddddddddddddddddddd"},
  "compatibility": {"architecture": "amd64"}
}
