{
  "schemaVersion": "1.0",
  "releaseId": "spec108-r1",
  "candidateId": "spec107-c1-111111111111-222222222222-333333333333-444444444444-555555555555-666666666666",
  "sourceRevision": "0123456789abcdef0123456789abcdef01234567",
  "createdAt": "2026-07-12T12:00:00Z",
  "images": {
    "linux-amd64-cpu": {
      "reference": "registry.example/ndnsf-di@sha256:aaaaaaaaaaaaaaaaaaaaaaaaaaaaaaaaaaaaaaaaaaaaaaaaaaaaaaaaaaaaaaaa",
      "digest": "sha256:aaaaaaaaaaaaaaaaaaaaaaaaaaaaaaaaaaaaaaaaaaaaaaaaaaaaaaaaaaaaaaaa",
      "platform": "linux/amd64",
      "backend": "cpu"
    }
  },
  "buildInputs": [
    {"path": "oci/locks/common.lock", "digest": "sha256:bbbbbbbbbbbbbbbbbbbbbbbbbbbbbbbbbbbbbbbbbbbbbbbbbbbbbbbbbbbbbbbb"}
  ],
  "sbom": {"location": "sbom.spdx.json", "digest": "sha256:cccccccccccccccccccccccccccccccccccccccccccccccccccccccccccccccc"},
  "provenance": {"builder": "spec108-test", "digest": "sha256:dddddddddddddddddddddddddddddddddddddddddddddddddddddddddddddddd"},
  "compatibility": {"architecture": "amd64", "cuda": null, "onnxRuntime": "1.x"}
}
